Id,Code,Name,Standard Class,Domain,Vocab,Validity,Concept,Frequency
4158970,370943001,Glaucoma drainage device,Physical Object,Device,SNOMED,Valid,Standard,1
4150035,31030004,Peritoneal catheter,Physical Object,Device,SNOMED,Valid,Standard,1
4147885,310835009,External fixator frame component,Physical Object,Device,SNOMED,Valid,Standard,1
4147427,310196006,YAG - laser,Physical Object,Device,SNOMED,Valid,Standard,1
4131235,410444004,Nonvalved ophthalmic drainage device,Physical Object,Device,SNOMED,Valid,Standard,1
4128970,261206000,External fixator using static unilateral bar,Physical Object,Device,SNOMED,Valid,Standard,1
4126195,261241001,Arterial line,Physical Object,Device,SNOMED,Valid,Standard,1
4125335,303608005,Ophthalmological implant,Physical Object,Device,SNOMED,Valid,Standard,1
4122371,258644008,Abdominal drain,Physical Object,Device,SNOMED,Valid,Standard,1
4121352,258648006,Optical filter,Physical Object,Device,SNOMED,Valid,Standard,1
4117595,303500007,Auditory implant,Physical Object,Device,SNOMED,Valid,Standard,1
4117157,256717004,Nasal flap,Substance,Device,SNOMED,Invalid,Non-standard,1
4115423,256737000,Forehead flap,Substance,Device,SNOMED,Invalid,Non-standard,1
4110846,180806005,Gastrocnemius flap,Substance,Device,SNOMED,Valid,Standard,1
4110842,180783009,Vastus lateralis myocutaneous flap,Substance,Device,SNOMED,Valid,Standard,1
4110838,180775003,Rectus femoris myocutaneous flap,Substance,Device,SNOMED,Valid,Standard,1
4109581,180725000,Lateral lower leg fasciocutaneous flap,Substance,Device,SNOMED,Invalid,Non-standard,1
4106991,257338003,Partial ossicular replacement prosthesis,Physical Object,Device,SNOMED,Valid,Standard,1
4106981,257287003,Tube drain,Physical Object,Device,SNOMED,Valid,Standard,1
4106980,257284005,Conduit with homograft valve,Physical Object,Device,SNOMED,Valid,Standard,1
4106958,257215003,Nail instrument,Physical Object,Device,SNOMED,Valid,Standard,1
4106243,180800004,Gluteus maximus flap,Substance,Device,SNOMED,Valid,Standard,1
4106139,257302005,Rigid intramedullary nail,Physical Object,Device,SNOMED,Valid,Standard,1
4106124,180760006,Pectoralis major myocutaneous flap,Substance,Device,SNOMED,Valid,Standard,1
4106015,257218001,Flexible cystoscope,Physical Object,Device,SNOMED,Valid,Standard,1
4105810,256838002,Posterior thigh flap,Substance,Device,SNOMED,Invalid,Non-standard,1
4105678,256683004,Flap,Substance,Device,SNOMED,Valid,Standard,1
4105669,256653008,Cadaveric bone graft,Substance,Device,SNOMED,Valid,Standard,1
4105044,256842004,Anterior tibial flap,Substance,Device,SNOMED,Invalid,Non-standard,1
4082570,183187001,Halo brace,Physical Object,Device,SNOMED,Valid,Standard,1
40664487,L5961,"Addition, endoskeletal system, polycentric hip joint, pneumatic or hydraulic control, rotation control, with or without flexion and/or extension control",HCPCS,Device,HCPCS,Valid,Standard,1
40658517,Q9968,"Injection, non-radioactive, non-contrast, visualization adjunct (e.g., methylene blue, isosulfan blue), 1 mg",HCPCS,Device,HCPCS,Valid,Standard,1
40488338,446559007,Peripheral vascular catheter,Physical Object,Device,SNOMED,Valid,Standard,1
40487895,446476009,Umbilical catheter,Physical Object,Device,SNOMED,Valid,Standard,1
4048015,20613002,Cystoscope,Physical Object,Device,SNOMED,Valid,Standard,1
40479423,444449007,"Dual chamber pacing cardioverter defibrillator pulse generator, device",Physical Object,Device,SNOMED,Valid,Standard,1
4046730,122456005,Laser device,Physical Object,Device,SNOMED,Valid,Standard,1
4044008,129121000,Tracheostomy tube,Physical Object,Device,SNOMED,Valid,Standard,1
4042166,118380004,Implantable defibrillator leads,Physical Object,Device,SNOMED,Valid,Standard,1
4040918,118426006,Ommaya reservoir,Physical Object,Device,SNOMED,Valid,Standard,1
4040747,118312003,Carbon dioxide laser device,Physical Object,Device,SNOMED,Valid,Standard,1
4040381,118620008,Free graft,Substance,Device,SNOMED,Valid,Standard,1
4025036,105794008,Scope AND/OR camera,Physical Object,Device,SNOMED,Valid,Standard,1
2721938,V5220,"Hearing aid, bicros, behind the ear (Deprecated)",HCPCS,Device,HCPCS,Valid,Standard,1
2721854,V2500,"Contact lens, pmma, spherical, per lens",HCPCS,Device,HCPCS,Valid,Standard,1
2720859,Q9956,"Injection, octafluoropropane microspheres, per ml",HCPCS,Device,HCPCS,Valid,Standard,1
2720728,Q4017,"Cast supplies, long arm splint, adult (11 years +), plaster",HCPCS,Device,HCPCS,Valid,Standard,1
2720483,L9900,"Orthotic and prosthetic supply, accessory, and/or service component of another hcpcs ""l"" code",HCPCS,Device,HCPCS,Valid,Standard,1
2720443,L8600,"Implantable breast prosthesis, silicone or equal",HCPCS,Device,HCPCS,Valid,Standard,1
2720355,L7362,"Battery charger, six volt, each",HCPCS,Device,HCPCS,Valid,Standard,1
2720354,L7360,"Six volt battery, each",HCPCS,Device,HCPCS,Valid,Standard,1
2720344,L7181,"Electronic elbow, microprocessor simultaneous control of elbow and terminal device",HCPCS,Device,HCPCS,Valid,Standard,1
2720343,L7180,"Electronic elbow, microprocessor sequential control of elbow and terminal device",HCPCS,Device,HCPCS,Valid,Standard,1
2720326,L6955,"Above elbow, external power, molded inner socket, removable humeral shell, internal locking elbow, forearm, otto bock or equal electrodes, cables, two batteries and one charger, myoelectronic control of terminal device",HCPCS,Device,HCPCS,Valid,Standard,1
2720311,L6884,"Replacement socket, above elbow/elbow disarticulation, molded to patient model, for use with or without external power",HCPCS,Device,HCPCS,Valid,Standard,1
2720310,L6883,"Replacement socket, below elbow/wrist disarticulation, molded to patient model, for use with or without external power",HCPCS,Device,HCPCS,Valid,Standard,1
2720257,L6704,"Terminal device, sport/recreational/work attachment, any material, any size",HCPCS,Device,HCPCS,Valid,Standard,1
2720256,L6703,"Terminal device, passive hand/mitt, any material, any size",HCPCS,Device,HCPCS,Valid,Standard,1
2720246,L6690,"Upper extremity addition, frame type socket, interscapular-thoracic",HCPCS,Device,HCPCS,Valid,Standard,1
2720230,L6650,"Upper extremity addition, shoulder universal joint, each",HCPCS,Device,HCPCS,Valid,Standard,1
2720227,L6646,"Upper extremity addition, shoulder joint, multipositional locking, flexion, adjustable abduction friction control, for use with body powered or external powered system",HCPCS,Device,HCPCS,Valid,Standard,1
2720221,L6638,"Upper extremity addition to prosthesis, electric locking feature, only for use with manually powered elbow",HCPCS,Device,HCPCS,Valid,Standard,1
2720217,L6630,"Upper extremity addition, stainless steel, any wrist",HCPCS,Device,HCPCS,Valid,Standard,1
2720210,L6620,"Upper extremity addition, flexion/extension wrist unit, with or without friction",HCPCS,Device,HCPCS,Valid,Standard,1
2720196,L6550,"Shoulder disarticulation, molded socket, endoskeletal system, including soft prosthetic tissue shaping",HCPCS,Device,HCPCS,Valid,Standard,1
2720183,L6310,"Shoulder disarticulation, passive restoration (complete prosthesis)",HCPCS,Device,HCPCS,Valid,Standard,1
2720179,L6200,"Elbow disarticulation, molded socket, outside locking hinge, forearm",HCPCS,Device,HCPCS,Valid,Standard,1
2720176,L6110,"Below elbow, molded socket, (muenster or northwestern suspension types)",HCPCS,Device,HCPCS,Valid,Standard,1
2720145,L5966,"Addition, endoskeletal system, hip disarticulation, flexible protective outer surface covering system",HCPCS,Device,HCPCS,Valid,Standard,1
2720139,L5930,"Addition, endoskeletal system, high activity knee control frame",HCPCS,Device,HCPCS,Valid,Standard,1
2720123,L5826,"Addition, endoskeletal knee-shin system, single axis, hydraulic swing phase control, with miniature high activity frame",HCPCS,Device,HCPCS,Valid,Standard,1
2720120,L5818,"Addition, endoskeletal knee-shin system, polycentric, friction swing, and stance phase control",HCPCS,Device,HCPCS,Valid,Standard,1
2720098,L5707,"Custom shaped protective cover, hip disarticulation",HCPCS,Device,HCPCS,Valid,Standard,1
2720060,L5665,"Addition to lower extremity, socket insert, multi-durometer, below knee",HCPCS,Device,HCPCS,Valid,Standard,1
2720028,L5628,"Addition to lower extremity, test socket, hemipelvectomy",HCPCS,Device,HCPCS,Valid,Standard,1
2720025,L5622,"Addition to lower extremity, test socket, knee disarticulation",HCPCS,Device,HCPCS,Valid,Standard,1
2720023,L5618,"Addition to lower extremity, test socket, symes",HCPCS,Device,HCPCS,Valid,Standard,1
2720018,L5611,"Addition to lower extremity, endoskeletal system, above knee - knee disarticulation, 4 bar linkage, with friction swing phase control",HCPCS,Device,HCPCS,Valid,Standard,1
2720012,L5580,"Preparatory, above knee - knee disarticulation ischial level socket, non-alignable system, pylon, no cover, sach foot, thermoplastic or equal, molded to model",HCPCS,Device,HCPCS,Valid,Standard,1
2720009,L5540,"Preparatory, below knee 'ptb' type socket, non-alignable system, pylon, no cover, sach foot, laminated socket, molded to model",HCPCS,Device,HCPCS,Valid,Standard,1
2719998,L5410,"Immediate post surgical or early fitting, application of initial rigid dressing, including fitting, alignment and suspension, below knee, each additional cast change and realignment",HCPCS,Device,HCPCS,Valid,Standard,1
2719996,L5341,"Hemipelvectomy, canadian type, molded socket, endoskeletal system, hip joint, single axis knee, sach foot",HCPCS,Device,HCPCS,Valid,Standard,1
2719976,L5100,"Below knee, molded socket, shin, sach foot",HCPCS,Device,HCPCS,Valid,Standard,1
2719972,L5010,"Partial foot, molded socket, ankle height, with toe filler",HCPCS,Device,HCPCS,Valid,Standard,1
2719967,L4392,"Replacement, soft interface material, static afo",HCPCS,Device,HCPCS,Valid,Standard,1
2719955,L4110,"Replace leather cuff kafo-afo, calf or distal thigh",HCPCS,Device,HCPCS,Valid,Standard,1
2719889,L3921,"Hand finger orthosis, includes one or more nontorsion joints, elastic bands, turnbuckles, may include soft interface, straps, custom fabricated, includes fitting and adjustment",HCPCS,Device,HCPCS,Valid,Standard,1
2719826,L3630,"Transfer of an orthosis from one shoe to another, solid stirrup, new",HCPCS,Device,HCPCS,Valid,Standard,1
2719823,L3600,"Transfer of an orthosis from one shoe to another, caliper plate, existing",HCPCS,Device,HCPCS,Valid,Standard,1
2719817,L3550,"Orthopedic shoe addition, toe tap standard",HCPCS,Device,HCPCS,Valid,Standard,1
2719816,L3540,"Orthopedic shoe addition, sole, full",HCPCS,Device,HCPCS,Valid,Standard,1
2719796,L3360,"Sole wedge, outside sole",HCPCS,Device,HCPCS,Valid,Standard,1
2719791,L3330,"Lift, elevation, metal extension (skate)",HCPCS,Device,HCPCS,Valid,Standard,1
2719782,L3253,"Foot, molded shoe plastazote (or similar) custom fitted, each",HCPCS,Device,HCPCS,Valid,Standard,1
2719776,L3224,"Orthopedic footwear, woman's shoe, oxford, used as an integral part of a brace (orthosis)",HCPCS,Device,HCPCS,Valid,Standard,1
2719755,L3170,"Foot, plastic, silicone or equal, heel stabilizer, prefabricated, off-the-shelf, each",HCPCS,Device,HCPCS,Valid,Standard,1
2719746,L3050,"Foot, arch support, removable, premolded, metatarsal, each",HCPCS,Device,HCPCS,Valid,Standard,1
2719743,L3030,"Foot, insert, removable, formed to patient foot, each",HCPCS,Device,HCPCS,Valid,Standard,1
2719737,L3000,"Foot, insert, removable, molded to patient model, 'ucb' type, berkeley shell, each",HCPCS,Device,HCPCS,Valid,Standard,1
2719723,L2760,"Addition to lower extremity orthosis, extension, per extension, per bar (for lineal adjustment for growth)",HCPCS,Device,HCPCS,Valid,Standard,1
2719716,L2640,"Addition to lower extremity, pelvic control, band and belt, bilateral",HCPCS,Device,HCPCS,Valid,Standard,1
2719713,L2627,"Addition to lower extremity, pelvic control, plastic, molded to patient model, reciprocating hip joint and cables",HCPCS,Device,HCPCS,Valid,Standard,1
2719711,L2622,"Addition to lower extremity, pelvic control, hip joint, adjustable flexion, each",HCPCS,Device,HCPCS,Valid,Standard,1
2719708,L2600,"Addition to lower extremity, pelvic control, hip joint, clevis type, or thrust bearing, free, each",HCPCS,Device,HCPCS,Valid,Standard,1
2719690,L2395,"Addition to lower extremity, offset knee joint, heavy duty, each joint",HCPCS,Device,HCPCS,Valid,Standard,1
2719688,L2387,"Addition to lower extremity, polycentric knee joint, for custom fabricated knee ankle foot orthosis, each joint",HCPCS,Device,HCPCS,Valid,Standard,1
2719667,L2230,"Addition to lower extremity, split flat caliper stirrups and plate attachment",HCPCS,Device,HCPCS,Valid,Standard,1
2719661,L2188,"Addition to lower extremity fracture orthosis, quadrilateral brim",HCPCS,Device,HCPCS,Valid,Standard,1
2719656,L2136,"Kafo, fracture orthosis, femoral fracture cast orthosis, rigid, prefabricated, includes fitting and adjustment",HCPCS,Device,HCPCS,Valid,Standard,1
2719649,L2116,"Ankle foot orthosis, fracture orthosis, tibial fracture orthosis, rigid, prefabricated, includes fitting and adjustment",HCPCS,Device,HCPCS,Valid,Standard,1
2719630,L2030,"Knee ankle foot orthosis, double upright, free ankle, solid stirrup, thigh and calf bands/cuffs, (double bar 'ak' orthosis), without knee joint, custom fabricated",HCPCS,Device,HCPCS,Valid,Standard,1
2719624,L1980,"Ankle foot orthosis, single upright free plantar dorsiflexion, solid stirrup, calf band/cuff (single bar 'bk' orthosis), custom fabricated",HCPCS,Device,HCPCS,Valid,Standard,1
2719614,L1920,"Ankle foot orthosis, single upright with static or adjustable stop (phelps or perlstein type), custom fabricated",HCPCS,Device,HCPCS,Valid,Standard,1
2719596,L1844,"Knee orthosis, single upright, thigh and calf, with adjustable flexion and extension joint (unicentric or polycentric), medial-lateral and rotation control, with or without varus/valgus adjustment, custom fabricated",HCPCS,Device,HCPCS,Valid,Standard,1
2719577,L1690,"Combination, bilateral, lumbo-sacral, hip, femur orthosis providing adduction and internal rotation control, prefabricated, includes fitting and adjustment",HCPCS,Device,HCPCS,Valid,Standard,1
2719572,L1652,"Hip orthosis, bilateral thigh cuffs with adjustable abductor spreader bar, adult size, prefabricated, includes fitting and adjustment, prefabricated item that has been trimmed, bent, molded, assembled, or otherwise customized to fit a specific patient...",HCPCS,Device,HCPCS,Valid,Standard,1
2719559,L1290,"Addition to tlso, (low profile), lateral trochanteric pad",HCPCS,Device,HCPCS,Valid,Standard,1
2719551,L1210,"Addition to tlso, (low profile), lateral thoracic extension",HCPCS,Device,HCPCS,Valid,Standard,1
2719497,L0630,"Lumbar-sacral orthosis, sagittal control, with rigid posterior panel(s), posterior extends from sacrococcygeal junction to t-9 vertebra, produces intracavitary pressure to reduce load on the intervertebral discs, includes straps, closures, may include...",HCPCS,Device,HCPCS,Valid,Standard,1
2719469,L0484,"Tlso, triplanar control, two piece rigid plastic shell without interface liner, with multiple straps and closures, posterior extends from sacrococcygeal junction and terminates just inferior to scapular spine, anterior extends from symphysis pubis to s...",HCPCS,Device,HCPCS,Valid,Standard,1
2719459,L0464,"Tlso, triplanar control, modular segmented spinal system, four rigid plastic shells, posterior extends from sacrococcygeal junction and terminates just inferior to scapular spine, anterior extends from symphysis pubis to the sternal notch, soft liner,...",HCPCS,Device,HCPCS,Valid,Standard,1
2719457,L0460,"Tlso, triplanar control, modular segmented spinal system, two rigid plastic shells, posterior extends from the sacrococcygeal junction and terminates just inferior to the scapular spine, anterior extends from the symphysis pubis to the sternal notch, s...",HCPCS,Device,HCPCS,Valid,Standard,1
2719454,L0454,"Tlso flexible, provides trunk support, extends from sacrococcygeal junction to above t-9 vertebra, restricts gross trunk motion in the sagittal plane, produces intracavitary pressure to reduce load on the intervertebral disks with rigid stays or panel(...",HCPCS,Device,HCPCS,Valid,Standard,1
2719428,L0190,"Cervical, multiple post collar, occipital/mandibular supports, adjustable cervical bars (somi, guilford, taylor types)",HCPCS,Device,HCPCS,Valid,Standard,1
2719426,L0174,"Cervical, collar, semi-rigid, thermoplastic foam, two piece with thoracic extension, prefabricated, off-the-shelf",HCPCS,Device,HCPCS,Valid,Standard,1
2616999,E1810,"Dynamic adjustable knee extension and flexion device, includes soft interface material",HCPCS,Device,HCPCS,Valid,Standard,1
2616533,E0191,"Heel or elbow protector, each",HCPCS,Device,HCPCS,Valid,Standard,1
2615873,C1897,"Lead, neurostimulator test kit (implantable)",HCPCS,Device,HCPCS,Valid,Standard,1
2615827,C1820,"Generator, neurostimulator (implantable), with rechargeable battery and charging system",HCPCS,Device,HCPCS,Valid,Standard,1
2615820,C1813,"Prosthesis, penile, inflatable",HCPCS,Device,HCPCS,Valid,Standard,1
2615798,C1788,"Port, indwelling (implantable)",HCPCS,Device,HCPCS,Valid,Standard,1
2615797,C1787,"Patient programmer, neurostimulator",HCPCS,Device,HCPCS,Valid,Standard,1
2615404,A9700,"Supply of injectable contrast material for use in echocardiography, per study",HCPCS,Device,HCPCS,Valid,Standard,1
2615398,A9580,"Sodium fluoride f-18, diagnostic, per study dose, up to 30 millicuries",HCPCS,Device,HCPCS,Valid,Standard,1
2615312,A9276,"Sensor; invasive (e.g., subcutaneous), disposable, for use with non-durable medical equipment interstitial continuous glucose monitoring system, one unit = 1 day supply",HCPCS,Device,HCPCS,Valid,Standard,1
2615193,A6450,"Light compression bandage, elastic, knitted/woven, width greater than or equal to five inches, per yard",HCPCS,Device,HCPCS,Valid,Standard,1
2615113,A6213,"Foam dressing, wound cover, sterile, pad size more than 16 sq. in. but less than or equal to 48 sq. in., with any size adhesive border, each dressing",HCPCS,Device,HCPCS,Valid,Standard,1
2615112,A6212,"Foam dressing, wound cover, sterile, pad size 16 sq. in. or less, with any size adhesive border, each dressing",HCPCS,Device,HCPCS,Valid,Standard,1
2615074,A5503,"For diabetics only, modification (including fitting) of off-the-shelf depth-inlay shoe or custom-molded shoe with roller or rigid rocker bottom, per shoe",HCPCS,Device,HCPCS,Valid,Standard,1
2614947,A4637,"Replacement, tip, cane, crutch, walker, each.",HCPCS,Device,HCPCS,Valid,Standard,1
2614912,A4595,"Electrical stimulator supplies, 2 lead, per month, (e.g., tens, nmes)",HCPCS,Device,HCPCS,Valid,Standard,1
2614897,A4550,Surgical trays,HCPCS,Device,HCPCS,Valid,Standard,1
2614782,A4356,"External urethral clamp or compression device (not to be used for catheter clamp), each",HCPCS,Device,HCPCS,Valid,Standard,1
2614749,A4313,"Insertion tray without drainage bag with indwelling catheter, foley type, three-way, for continuous irrigation",HCPCS,Device,HCPCS,Valid,Standard,1
1314557,L1852,"Knee orthosis (ko), double upright, thigh and calf, with adjustable flexion and extension joint (unicentric or polycentric), medial-lateral and rotation control, with or without varus/valgus adjustment, prefabricated, off-the-shelf",HCPCS,Device,HCPCS,Valid,Standard,1
